{
  "schemaVersion": "jlink-mcp.requirement-traceability/v1",
  "specVersion": "0.2.1",
  "revision": 1,
  "status": "frozen",
  "scopeChange": "none",
  "authoritativeSpec": {
    "file": "spec/Jlink_MCP_v0.2.1_Functional_Spec_Rev1_Frozen.md",
    "sourceFile": "Jlink_MCP_v0.2.1_Function_List_Updated.md",
    "sourceSha256": "12e46eda65d07e29eee67fd4e783093190c8ecdf8e2cd170b6eb5ef7e62b173b"
  },
  "generatedAt": "2026-07-14T00:00:00Z",
  "requirements": [
    {
      "id": "REQ-GEN-001",
      "section": "1",
      "heading": "项目定位",
      "title": "通用 MCU Runtime Access MCP",
      "statement": "Jlink_MCP 必须作为供 Codex/Agent 调用的通用本机 MCU Runtime Access MCP，而不是单一目标工程或单一 MCU 的专用工具。",
      "normative": "MUST",
      "category": "architecture",
      "priority": "required",
      "ownerPhase": "P09",
      "implementationStatus": "unassessed",
      "acceptanceStatus": "not_run",
      "codeMapping": [],
      "plannedTests": [
        {
          "id": "TEST-REQ-GEN-001",
          "kind": "contract",
          "level": "release",
          "description": "生产代码在不依赖 HM_C095、FOC_SCM、固定目标 ID 或固定绝对路径的情况下可启动并完成能力发现。",
          "status": "planned",
          "evidence": []
        }
      ],
      "acceptanceCriteria": [
        "生产代码在不依赖 HM_C095、FOC_SCM、固定目标 ID 或固定绝对路径的情况下可启动并完成能力发现。",
        "至少一个非 HM_C095 的离线/模拟 fixture 通过公共合同测试。"
      ],
      "notes": []
    },
    {
      "id": "REQ-GEN-002",
      "section": "1",
      "heading": "项目定位",
      "title": "职责边界",
      "statement": "Jlink_MCP 不负责理解业务逻辑或决定调试结论；Agent 负责理解项目、选择工具和解释证据。",
      "normative": "MUST",
      "category": "architecture",
      "priority": "required",
      "ownerPhase": "P08",
      "implementationStatus": "unassessed",
      "acceptanceStatus": "not_run",
      "codeMapping": [],
      "plannedTests": [
        {
          "id": "TEST-REQ-GEN-002",
          "kind": "contract",
          "level": "module",
          "description": "server instructions、resources 和 prompts 不宣称 MCP 自动理解业务或生成项目语义结论。",
          "status": "planned",
          "evidence": []
        }
      ],
      "acceptanceCriteria": [
        "server instructions、resources 和 prompts 不宣称 MCP 自动理解业务或生成项目语义结论。"
      ],
      "notes": []
    },
    {
      "id": "REQ-GEN-003",
      "section": "1",
      "heading": "项目定位",
      "title": "结构化与可追溯输出",
      "statement": "所有核心运行时访问必须输出可靠、可追溯、结构化的数据和证据引用。",
      "normative": "MUST",
      "category": "contract",
      "priority": "required",
      "ownerPhase": "P01",
      "implementationStatus": "unassessed",
      "acceptanceStatus": "not_run",
      "codeMapping": [],
      "plannedTests": [
        {
          "id": "TEST-REQ-GEN-003",
          "kind": "contract",
          "level": "module",
          "description": "核心工具返回统一 envelope，包含 operation、risk、backend、artifacts、warnings 和结果状态。",
          "status": "planned",
          "evidence": []
        }
      ],
      "acceptanceCriteria": [
        "核心工具返回统一 envelope，包含 operation、risk、backend、artifacts、warnings 和结果状态。",
        "改变目标状态的操作能够关联 plan、audit 和验证结果。"
      ],
      "notes": []
    },
    {
      "id": "REQ-GEN-004",
      "section": "1",
      "heading": "项目定位",
      "title": "运行时不依赖 Git",
      "statement": "MCP 产品运行时不得依赖目标工程使用 Git，也不得通过 Git 命令确定 projectRoot。",
      "normative": "MUST",
      "category": "negative",
      "priority": "required",
      "ownerPhase": "P01",
      "implementationStatus": "unassessed",
      "acceptanceStatus": "not_run",
      "codeMapping": [],
      "plannedTests": [
        {
          "id": "TEST-REQ-GEN-004",
          "kind": "contract",
          "level": "module",
          "description": "静态检查和集成测试证明运行时 project context 不调用 Git。",
          "status": "planned",
          "evidence": []
        }
      ],
      "acceptanceCriteria": [
        "静态检查和集成测试证明运行时 project context 不调用 Git。",
        "非 Git fixture 可正常初始化 `.jlink-mcp`。"
      ],
      "notes": []
    },
    {
      "id": "REQ-GEN-005",
      "section": "1",
      "heading": "项目定位",
      "title": "不强制修改 MCU 代码",
      "statement": "第一版不得要求目标 MCU 工程为使用 MCP 而修改、插桩或新增运行时代码。",
      "normative": "MUST",
      "category": "negative",
      "priority": "required",
      "ownerPhase": "P09",
      "implementationStatus": "unassessed",
      "acceptanceStatus": "not_run",
      "codeMapping": [],
      "plannedTests": [
        {
          "id": "TEST-REQ-GEN-005",
          "kind": "integration",
          "level": "release",
          "description": "硬件验收前后目标源码 fingerprint 一致，sourceModified=false。",
          "status": "planned",
          "evidence": []
        }
      ],
      "acceptanceCriteria": [
        "硬件验收前后目标源码 fingerprint 一致，sourceModified=false。",
        "HSS、Background Memory、RSP 和 SVD 主流程不依赖新增目标端代码。"
      ],
      "notes": []
    },
    {
      "id": "REQ-ROLE-001",
      "section": "2",
      "heading": "主从关系",
      "title": "Agent 决策责任",
      "statement": "Agent/Codex 必须负责理解项目、判断问题、选择调试流程和选择 MCP 工具。",
      "normative": "MUST",
      "category": "architecture",
      "priority": "required",
      "ownerPhase": "P08",
      "implementationStatus": "unassessed",
      "acceptanceStatus": "not_run",
      "codeMapping": [],
      "plannedTests": [
        {
          "id": "TEST-REQ-ROLE-001",
          "kind": "contract",
          "level": "module",
          "description": "Agent workflow 文档明确 MCP 只提供能力与证据，Agent 负责决策。",
          "status": "planned",
          "evidence": []
        }
      ],
      "acceptanceCriteria": [
        "Agent workflow 文档明确 MCP 只提供能力与证据，Agent 负责决策。"
      ],
      "notes": []
    },
    {
      "id": "REQ-ROLE-002",
      "section": "2",
      "heading": "主从关系",
      "title": "MCP 工具层责任",
      "statement": "Jlink_MCP 必须提供 J-Link、HSS、SVD、变量读写、采样、Flash 和审计能力，不越权替代 Agent。",
      "normative": "MUST",
      "category": "architecture",
      "priority": "required",
      "ownerPhase": "P08",
      "implementationStatus": "unassessed",
      "acceptanceStatus": "not_run",
      "codeMapping": [],
      "plannedTests": [
        {
          "id": "TEST-REQ-ROLE-002",
          "kind": "contract",
          "level": "module",
          "description": "mcu_capabilities 和 mcu_tool_catalog 能枚举公共能力及其风险。",
          "status": "planned",
          "evidence": []
        }
      ],
      "acceptanceCriteria": [
        "mcu_capabilities 和 mcu_tool_catalog 能枚举公共能力及其风险。"
      ],
      "notes": []
    },
    {
      "id": "REQ-ROLE-003",
      "section": "2",
      "heading": "主从关系",
      "title": "用户确认边界",
      "statement": "用户只在 R4 高风险执行时提供人工确认；R0-R3 按 policy 和 operationPlan 自动治理，R5 永久拒绝。",
      "normative": "MUST",
      "category": "safety",
      "priority": "required",
      "ownerPhase": "P07",
      "implementationStatus": "unassessed",
      "acceptanceStatus": "not_run",
      "codeMapping": [],
      "plannedTests": [
        {
          "id": "TEST-REQ-ROLE-003",
          "kind": "integration",
          "level": "phase",
          "description": "R4 execute 无可信 approval receipt 时稳定拒绝。",
          "status": "planned",
          "evidence": []
        }
      ],
      "acceptanceCriteria": [
        "R4 execute 无可信 approval receipt 时稳定拒绝。",
        "R0-R3 不要求裸人工确认；R5 无任何执行路径。"
      ],
      "notes": []
    },
    {
      "id": "REQ-PATH-001",
      "section": "3",
      "heading": "项目路径策略",
      "title": "projectRoot 等于 cwd",
      "statement": "projectRoot 必须等于 MCP 进程启动时的 process.cwd()。",
      "normative": "MUST",
      "category": "contract",
      "priority": "required",
      "ownerPhase": "P01",
      "implementationStatus": "unassessed",
      "acceptanceStatus": "not_run",
      "codeMapping": [],
      "plannedTests": [
        {
          "id": "TEST-REQ-PATH-001",
          "kind": "integration",
          "level": "module",
          "description": "在不同 cwd 启动时 projectRoot 精确等于对应规范化 cwd。",
          "status": "planned",
          "evidence": []
        }
      ],
      "acceptanceCriteria": [
        "在不同 cwd 启动时 projectRoot 精确等于对应规范化 cwd。"
      ],
      "notes": []
    },
    {
      "id": "REQ-PATH-002",
      "section": "3",
      "heading": "项目路径策略",
      "title": "不调用 Git 定位根目录",
      "statement": "MCP 运行时不得调用 Git 命令或查找 Git 根目录来确定 projectRoot。",
      "normative": "MUST",
      "category": "negative",
      "priority": "required",
      "ownerPhase": "P01",
      "implementationStatus": "unassessed",
      "acceptanceStatus": "not_run",
      "codeMapping": [],
      "plannedTests": [
        {
          "id": "TEST-REQ-PATH-002",
          "kind": "contract",
          "level": "module",
          "description": "无 Git 环境测试通过，且静态检查未发现运行时 Git root 探测。",
          "status": "planned",
          "evidence": []
        }
      ],
      "acceptanceCriteria": [
        "无 Git 环境测试通过，且静态检查未发现运行时 Git root 探测。"
      ],
      "notes": []
    },
    {
      "id": "REQ-PATH-003",
      "section": "3",
      "heading": "项目路径策略",
      "title": "工具不要求 projectRoot 参数",
      "statement": "公共工具不得要求用户重复传入 projectRoot。",
      "normative": "MUST",
      "category": "contract",
      "priority": "required",
      "ownerPhase": "P01",
      "implementationStatus": "unassessed",
      "acceptanceStatus": "not_run",
      "codeMapping": [],
      "plannedTests": [
        {
          "id": "TEST-REQ-PATH-003",
          "kind": "contract",
          "level": "module",
          "description": "公共 tool schema 中不存在必填 projectRoot 参数；project context 来自 server cwd。",
          "status": "planned",
          "evidence": []
        }
      ],
      "acceptanceCriteria": [
        "公共 tool schema 中不存在必填 projectRoot 参数；project context 来自 server cwd。"
      ],
      "notes": []
    },
    {
      "id": "REQ-PATH-004",
      "section": "3",
      "heading": "项目路径策略",
      "title": "默认输出目录",
      "statement": "默认输出必须位于 `<cwd>/.jlink-mcp/`。",
      "normative": "MUST",
      "category": "contract",
      "priority": "required",
      "ownerPhase": "P01",
      "implementationStatus": "unassessed",